{"schema":"jin-math-computation-handoff/v1","problem_id":"preproject-rh","window_id":"pre-genesis-sequential","attempt_id":"A-RH-SRE-0007","claim_id":null,"objective_sha256":"31b43e92673ece01af51c4f8c97b9c22ad1db4cfd2e457693a37f3d472d3a902","question":"Extract a separated simple-real exponential subfamily and local lattice matching from the finite signed Hilbert-space defect, with exact slack decomposition and explicit deletion/energy constants.","domain":"Finite signed Hilbert-space families and box-profile complex exponentials; simple real Gram matrices, maximal matching and blockwise lattice phases.","assumptions":["Finite family; simple vectors have norm one; non-simple real weights >=2; pair weights >=1 and ||g||^2-||h||^2=1.","Box profile is required for sinc separation/matching; all analytic hypotheses appear in README."],"requested_evidence":"numerical_evidence","backend":{"name":"Python/NumPy/mpmath/Fraction","version":"3.13.5","interface":"local foreground subprocess","inventory_snapshot_sha256":null},"exact_input":{"seed":2026090507,"samples":120,"quadrature_nodes":160,"scope":"objective_sha256 pins the bounded task README, NOT a canonical v13 Project objective."},"reproduction_command":"OPENBLAS_NUM_THREADS=1 OMP_NUM_THREADS=1 python check_simple_energy.py --samples 120 --output validation.json","code_artifacts":[{"path":"check_simple_energy.py","sha256":"91c99a08270d82d4882bc83fcc5749fcec9cf4e3ac76eae68589976cb1c6f2bd"}],"result_artifacts":[{"path":"validation.json","sha256":"d8da6a54c85ac7b750fb630bc24915fe563ab76b5f2424524b1ea1ecf6a29c1a"}],"computation_record":{"path":"computation-record.json","sha256":"64f3ed81d8b8d3defe8374e5f01a94b1e9c2e1c83e3e3c642571b81e66c935c1"},"evidence_grade":"numerical_evidence","cannot_imply":["Solver proof candidates and numerical self-checks; no independent-verifier receipt or Lean build.","The retained-energy and local-matching statements apply only to simple real elements, not the full zero multiset.","Small D/N is a conditional hypothesis, not a newly proved arithmetic fact about actual zeta zeros.","Box-profile sinc matching cannot be silently substituted into an optimized test profile.","Block phases need not agree; total mean density one and source cyclic-wrap consistency are not established.","Small discarded simple count does not guarantee negligible discarded Hilbert-Schmidt operator energy.","The no-trimming family is abstract, with repeated simple vectors; it is not a genuine simple-zero multiset.","Exact equality excludes non-real elements, but the shallow genuine-pair example prevents a uniform off-real count conclusion from small positive defect.","The anchor intrusion bound counts affected simple anchors, not non-simple pairs or their mass.","No source-budget closure, improved unconditional zeta proportion, RH proof/refutation, or literature-wide novelty is claimed.","No full repository CI/test suite, bundled inventory/record runner, upstream formal build or isolated verifier was run. Package-local hashes and JSON structure are checked separately."]}
