{"schema":"jin-math-computation-handoff/v1","problem_id":"preproject-rh","window_id":"pre-genesis-sequential","attempt_id":"A-RH-SMP-0009","claim_id":null,"objective_sha256":"783e96a34c448322ef719391badb1df4ce8273d9a145aab8695d0b82798a2190","question":"Extend hole-block short energy to sparse mosaics and low-total-variation continuous phase/depth fields, with explicit errors and scope counterexamples.","domain":"Finite signed continuous-box exponential operators on prescribed unit cells.","assumptions":["README (1), 0<alpha<=1 and depth cap A.","Sparse theorem: J/P tends to zero; continuous extension: V_P/P tends to zero, at fixed alpha and A.","Short-budget consequence additionally assumes total mass N=P and the displayed ideal moment bound."],"requested_evidence":"numerical_evidence","backend":{"name":"Python/NumPy/mpmath/Fraction","version":"3.13.5","interface":"local foreground subprocess","inventory_snapshot_sha256":null},"exact_input":{"seed":2026090609,"samples":120,"objective_scope":"README task hash, not a canonical v13 Project objective"},"reproduction_command":"OPENBLAS_NUM_THREADS=1 OMP_NUM_THREADS=1 python check_phase_mosaic.py --samples 120 --output validation.json","code_artifacts":[{"path":"check_phase_mosaic.py","sha256":"e8d187135b8d0dc859489d1be969a1980f7f1986322b4c36bba7364ebc64a6ff"}],"result_artifacts":[{"path":"validation.json","sha256":"37a1c25b3201f81a8609b798925a545b0a1482f99a1ccb6d7d3bde11ca484570"}],"computation_record":{"path":"computation-record.json","sha256":"a602b5d30b847624ffddb2ff2cc756b663217f97771e882cfe51a0e7cbc779f0"},"evidence_grade":"numerical_evidence","cannot_imply":["Finite-model solver proof candidates, not independently verified or formally proved.","One aggregate orbit per unit cell, marks 0/1/2, supplied phases in [0,1) and bounded depth are explicit assumptions.","Low variation is not inferred from long-scale equality; rapid interlacing is an exact scope counterexample.","The conditional 13/16 floor applies only to the restricted low-modulation class, not actual zeta zeros.","No control of dense microscopic interlacing, multi-orbit cells, growing-depth exceptions, source arithmetic or discarded operator energy.","Floating and high-precision quadrature are not interval certificates or universal proofs.","No full repository CI, bundled inventory/record runner or upstream Lean build was run.","No unconditional zero-proportion improvement, RH result or literature-wide novelty claim."]}
